{"at": "2026-09-27T06:40:35+00:00", "cycle": 0, "hypothesis": "baseline", "metrics": {"dimension_error_m": 3.0, "latency_ms": 53.647084, "pose_error_m": 0.001999999999999993, "scenario_error": 4.752, "selection_error": 1.75}, "outcome": "baseline"}
{"admit_sha": "3db764502d3e7238f18a6d907453300b71befd97", "at": "2026-09-27T06:43:00+00:00", "commit": "eaf1ca7d7ea44cd04b83a12691a6cd97fbfc487a", "cycle": 1, "feature_id": "dimension-estimation", "hypothesis": "Estimate pallet width, height, and depth in metres from the inlier face points used for pose.", "metrics": {"dimension_error_m": 0.0, "latency_ms": 54.695334, "pose_error_m": 0.001999999999999993, "scenario_error": 1.752, "selection_error": 1.75}, "outcome": "keep", "patch": "attempts/001.patch", "tag": "feature"}
{"admit_sha": "eaf1ca7d7ea44cd04b83a12691a6cd97fbfc487a", "at": "2026-09-27T06:45:53+00:00", "commit": "ec105a6b19d89cb8e57ea4eed3aa484585c14b1f", "cycle": 2, "feature_id": "multi-pallet-stage2", "hypothesis": "When several pallets are detected, send only a bounded subset through stage 2 and mark every other pallet deferred.", "metrics": {"dimension_error_m": 0.0, "latency_ms": 59.149686, "pose_error_m": 0.001999999999999993, "scenario_error": 0.001999999999999993, "selection_error": 0.0}, "outcome": "keep", "patch": "attempts/002.patch", "tag": "feature"}
{"admit_sha": "ec105a6b19d89cb8e57ea4eed3aa484585c14b1f", "at": "2026-09-27T06:50:29+00:00", "commit": "0da4ace1fe7efb7c4829b145a3df5e98e78c607a", "cycle": 3, "feature_id": null, "hypothesis": "Report face translation from the bbox-centre ray-plane intersection instead of the chamfer-refined centre.", "metrics": {"dimension_error_m": 0.0, "latency_ms": 57.123208, "pose_error_m": 0.0, "scenario_error": 0.0, "selection_error": 0.0}, "outcome": "keep", "patch": "attempts/003.patch", "tag": "tech-stack"}
{"admit_sha": "0da4ace1fe7efb7c4829b145a3df5e98e78c607a", "at": "2026-09-27T06:51:35+00:00", "cycle": 4, "feature_id": null, "hypothesis": "Cap the stage-2 loop at max_stage2 so a longer admission list cannot infer extra pallets.", "metrics": {"dimension_error_m": 0.0, "latency_ms": 59.076082, "pose_error_m": 0.0, "scenario_error": 0.0, "selection_error": 0.0}, "outcome": "revert", "patch": "attempts/004.patch", "tag": "implementation"}
{"admit_sha": "0da4ace1fe7efb7c4829b145a3df5e98e78c607a", "at": "2026-09-27T06:52:07+00:00", "cycle": 5, "feature_id": null, "hypothesis": "Record how many pallets were marked deferred on the diagnostic, without sending them through stage 2.", "metrics": {"dimension_error_m": 0.0, "latency_ms": 45.139782, "pose_error_m": 0.0, "scenario_error": 0.0, "selection_error": 0.0}, "outcome": "revert", "patch": "attempts/005.patch", "tag": "implementation"}
{"admit_sha": "0da4ace1fe7efb7c4829b145a3df5e98e78c607a", "at": "2026-09-27T06:52:36+00:00", "cycle": 6, "feature_id": null, "hypothesis": "Skip stage 2 for an admitted pallet whose bbox is non-finite, and leave it out of the inference loop.", "metrics": {"dimension_error_m": 0.0, "latency_ms": 44.438677, "pose_error_m": 0.0, "scenario_error": 0.0, "selection_error": 0.0}, "outcome": "revert", "patch": "attempts/006.patch", "tag": "implementation"}
{"admit_sha": "0da4ace1fe7efb7c4829b145a3df5e98e78c607a", "at": "2026-09-27T06:52:57+00:00", "cycle": 7, "feature_id": null, "hypothesis": "Do not run stage 2 on a pallet that the admission already marked deferred.", "metrics": {"dimension_error_m": 0.0, "latency_ms": 51.420415, "pose_error_m": 0.0, "scenario_error": 0.0, "selection_error": 0.0}, "outcome": "revert", "patch": "attempts/007.patch", "tag": "implementation"}
{"admit_sha": "0da4ace1fe7efb7c4829b145a3df5e98e78c607a", "at": "2026-09-27T06:53:27+00:00", "cycle": 8, "feature_id": null, "hypothesis": "Clamp max_stage2 so a large parameter still sends only a bounded subset into stage 2.", "metrics": {"dimension_error_m": 0.0, "latency_ms": 52.645697, "pose_error_m": 0.0, "scenario_error": 0.0, "selection_error": 0.0}, "outcome": "revert", "patch": "attempts/008.patch", "tag": "implementation"}
